{
  "type": "meteora_damm_v1_pool",
  "poolAddress": "2FppvT3ezcqiepzhsN6atTCmBgmLPSWWJmowrBYofq8m",
  "pair": {
    "base": "4zMMC9srt5Ri5X14GAgXhaHii3GnPAEERYPJgZJDncDU",
    "quote": "So11111111111111111111111111111111111111112"
  },
  "notes": "Meteora DAMM v1 USDC/SOL pool used for gas pricing on Esquiline."
}
